Title,Author1,Author2,Author3,Author4,Author5,Link,Summary,Cited By
… of expertise to improve science education and computer science quality (cross-fertilization principle)(Case study: Computer science program course FPMIPA UPI),BL Putro,,,,,https://ieeexplore.ieee.org/abstract/document/8257203/,"RRJ Putra, BL Putro - 2017 3rd International Conference on …, 2017 - ieeexplore.ieee.org",3
Enhanced Digital Library with Book Recommendations Based on Collaborative Filtering,E Junaeti,,,,,http://www.journaleet.in/index.php/jeet/article/view/157882,"E Nugraha, T Ardiansyah, E Junaeti… - Journal of Engineering …, 2020 - journaleet.in",0
Natural Language Processing and Levenshtein Distance for Generating Error Identification Typed Questions on TOEFL,LS Riza,EF Rahman,,,,https://ejournal.upi.edu/index.php/JCS/article/view/24940,"LS Riza, FS Anwar, EF Rahman… - Journal of Computers …, 2020 - ejournal.upi.edu",2
Monitoring system with two central facilities protocol,W Wahyudin,EP Nugroho,,,,https://ejournal.upi.edu/index.php/ijost/article/view/5986,"C Firdaus, W Wahyudin, EP Nugroho - Indonesian Journal of …, 2017 - ejournal.upi.edu",18
The application of ADDIE model in developing adventure game-based multimedia learning to improve students' understanding of basic programming,EF Rahman,,,,,https://ieeexplore.ieee.org/abstract/document/8257130/,"DR Hidayanto, EF Rahman… - 2017 3rd International …, 2017 - ieeexplore.ieee.org",8
SMS authentication code generated by Advance Encryption Standard (AES) 256 bits modification algorithm and One time Password (OTP) to activate new applicant …,EP Nugroho,,,,,https://ieeexplore.ieee.org/abstract/document/7852629/,"EP Nugroho, RRJ Putra… - 2016 2nd International …, 2016 - ieeexplore.ieee.org",9
Development of Computational Story for Teaching Algorithm and Programming,LS Riza,Y Wihardi,,,,https://ieeexplore.ieee.org/abstract/document/8878556/,"LS Riza, IA Aryani, Y Wihardi… - 2018 2nd East …, 2018 - ieeexplore.ieee.org",1
Implementation of CM-SPADE Algorithm In Building Denial of Service Detection System Model Using Snort,EP Nugroho,R Megasari,E Junaeti,,,https://scholar.archive.org/work/ecm6o7ze3rb2rjwbbvpehwnfdi/access/wayback/https://eudl.eu/pdf/10.4108/eai.12-10-2019.2296332,"EP Nugroho, R Megasari, E Junaeti, SR Pribadi - 2020 - scholar.archive.org",0
Analisis dan Pengukuran Technology Acceptance Model (TAM) dan End User Computing Satisfaction (EUCS) Terhadap Penerimaan Penerapan Sistem Input Nilai …,,,,,,http://kepo.unikom.ac.id/29684/,E Nugraha - 2014 - kepo.unikom.ac.id,2
Collaborative Information System Monitoring and Evaluation Tools Model,A Wahyudin,H Siregar,,,,https://ieeexplore.ieee.org/abstract/document/9392047/,"A Wahyudin, H Siregar… - 2020 6th International …, 2020 - ieeexplore.ieee.org",0
Development Mobile Learning For Vegetable Farming In Indonesia Based On Mobile Cloud Computing,Y Wihardi,E Nugraha,,,,https://ieeexplore.ieee.org/abstract/document/9392074/,"Y Wihardi, E Nugraha - 2020 6th International Conference on …, 2020 - ieeexplore.ieee.org",0
A development of cloud-based PHP learning system,EP Nugroho,,,,,https://ieeexplore.ieee.org/abstract/document/8257198/,"EP Nugroho, R Cahyana - 2017 3rd International …, 2017 - ieeexplore.ieee.org",1
An expert system for diagnosis of sleep disorder using fuzzy rule-based classification systems,LS Riza,EF Rahman,,,,https://iopscience.iop.org/article/10.1088/1757-899X/185/1/012011/meta,"LS Riza, M Pradini, EF Rahman - IOP Conference Series …, 2017 - iopscience.iop.org",12
Vocational Education in the Industrial 4.0 Era,A Hamdani,A Abdulkarim,D Cahyani,,,https://www.atlantis-press.com/article/125952263.pdf,"A Hamdani, A Abdulkarim, D Cahyani… - 6th UPI International …, 2021 - atlantis-press.com",0
A new approach on prediction of fever disease by using a combination of Dempster Shafer and Naïve bayes,EF Rahman,LS Riza,,,,https://ieeexplore.ieee.org/abstract/document/7852664/,"Y Mulyani, EF Rahman, LS Riza - 2016 2nd International …, 2016 - ieeexplore.ieee.org",14
"Experimental Study on Zoning, Histogram, and Structural Methods to Classify Sundanese Characters from Handwriting",,,,,,https://ieeexplore.ieee.org/abstract/document/8878640/,"E Nugraha, ACR Muhammad… - 2018 2nd East …, 2018 - ieeexplore.ieee.org",0
Identification of tomato plant diseases by Leaf image using squeezenet model,M Nursalman,,,,,https://ieeexplore.ieee.org/abstract/document/8696087/,"A Hidayatuloh, M Nursalman… - … Systems and Innovation …, 2018 - ieeexplore.ieee.org",12
Sistem Rekomendasi Film Menggunakan Metode Collaborative Filtering dan K-Nearest Neighbors,EP Nugroho,,,,,https://ejournal.upi.edu/index.php/JATIKOM/article/view/33208,"ER Agustian, EP Nugroho - Jurnal Aplikasi dan Teori Ilmu Komputer - ejournal.upi.edu",0
The use of scale invariant feature transform (SIFT) algorithms to identification garbage images based on product label,W Setiawan,A Wahyudin,,,,https://ieeexplore.ieee.org/abstract/document/8257135/,"W Setiawan, A Wahyudin… - 2017 3rd International …, 2017 - ieeexplore.ieee.org",5
Integrasi Sistem Data Pemilih Menggunakan Web Service dengan Metode Representational State Transfer (REST),A Wahyudin,H Siregar,,,,https://ejournal.upi.edu/index.php/JATIKOM/article/view/33210,"RD Hapsari, A Wahyudin, H Siregar - Jurnal Aplikasi dan Teori …, 2019 - ejournal.upi.edu",0
Behavioral tracking analysis on learning management system with apriori association rules algorithm,BL Putro,EP Nugroho,,,,https://ieeexplore.ieee.org/abstract/document/8257141/,"D Aviano, BL Putro, EP Nugroho… - 2017 3rd International …, 2017 - ieeexplore.ieee.org",4
Strengthening of Indonesia school of management in the 21st century through the implementation of school management system based information technology and …,W Setiawan,Munir,SH Senen,,,https://aip.scitation.org/doi/abs/10.1063/1.4983988,"W Setiawan, Munir, SH Senen… - AIP Conference …, 2017 - aip.scitation.org",2
DIGITAL SIGNATURE MENGGUNAKAN METODE SPREAD SPECTRUM SEBAGAI PERLINDUNGAN HAK CIPTA PADA CITRA DIGITAL MPEG-4,EF Rahman,,,,,https://ejournal.upi.edu/index.php/JATIKOM/article/view/33211,"FS Imami, RRJ Putra, EF Rahman - Jurnal Aplikasi dan Teori Ilmu …, 2019 - ejournal.upi.edu",0
Strategic Alignment Maturity Level Model Using Drivers of Change in a Business Environment,A Wahyudin,E Junaeti,,,,https://ieeexplore.ieee.org/abstract/document/9392036/,"A Wahyudin, AF Nasuha, E Junaeti - 2020 6th International …, 2020 - ieeexplore.ieee.org",0
Penerapan Algoritma Enchanced Confix Stripping dalam Pengukuran Keterbacaan Teks Menggunakan Gunning Fog Index,EF Rahman,,,,,http://jatikom.cs.upi.edu/index.php/jatikom/article/view/9,"YN Fadziah, EF Rahman - JATIKOM: Jurnal Aplikasi dan Teori …, 2018 - jatikom.cs.upi.edu",3
Kinect Based Motion Capture for 3D Character Animation,Y Wihardi,EF Rahman,,,,https://scholar.archive.org/work/nlnkuw6m75gy3fh647dk3ozezq/access/wayback/https://eudl.eu/pdf/10.4108/eai.12-10-2019.2296516,"Y Wihardi, EF Rahman, FF HN - 2020 - scholar.archive.org",0
Perancangan dan Implementasi Network Functions Virtualization (NFV) Berbasis Cloud Computing dengan OpenStack,EP Nugroho,,,,,http://jatikom.cs.upi.edu/index.php/jatikom/article/view/23,"A Jatikom, M Fadhil, EP Nugroho… - … : Jurnal Aplikasi dan …, 2018 - jatikom.cs.upi.edu",2
Implementasi Algoritma Extreme Learning Machine pada Prediksi Aktivitas Badai Geomagnetik,R Megasari,E Nugraha,,,,http://jatikom.cs.upi.edu/index.php/jatikom/article/view/8,"IRD Prawira, R Megasari, E Nugraha… - … : Jurnal Aplikasi dan …, 2018 - jatikom.cs.upi.edu",0
Requirement Engineering Method for Alignment of Information Technology (IT) Utilization with Education Business Strategy,BL Putro,,,,,https://scholar.archive.org/work/7vo7hpy63fd3flu6qex3bdaada/access/wayback/https://eudl.eu/pdf/10.4108/eai.12-10-2019.2296346,"BL Putro, H Sutarno, RRJ Putra, DI Suryana - 2020 - scholar.archive.org",0
THE PROMISE AND CAVEATS OF IMPLEMENTING DISCOVERY-INQUIRY LEARNING,EA Nurdin,,,,,https://scholar.archive.org/work/arfdmjgcdvbvbpuexajzxlanb4/access/wayback/https://ejournal.upi.edu/index.php/jpmipa/article/download/13909/pdf,"EA Nurdin - Jurnal Pengajaran MIPA, 2011 - scholar.archive.org",0
The Effectiveness of Multimedia in Education for Special Education (MESE) to Improve Reading Ability and Memorizing for Children with Intellectual Disability.,W Setiawan,EP Nugroho,,,,http://search.ebscohost.com/login.aspx?direct=true&profile=ehost&scope=site&authtype=crawler&jrnl=18630383&AN=131518607&h=4UcFEUUPuqEdNcGNqumYzRqFuA%2BPijZ7Wtant%2BT%2BA%2BflJvSUjNweTOGYel4hpA6MIyJNQ6NkLdwZFIr3GbfIbQ%3D%3D&crl=c,"W Setiawan, EP Nugroho… - … Journal of Emerging …, 2018 - search.ebscohost.com",6
Kajian Implementasi E-learning Berdasarkan Tingkat Kesiapan Peserta E-learning,EA Nurdin,H Herbert,,,,http://ejournal.gunadarma.ac.id/index.php/kommit/article/viewFile/1051/914,"S Hasanah, EA Nurdin, H Herbert - Prosiding KOMMIT, 2014 - ejournal.gunadarma.ac.id",0
Garbage Bank in Elementary Schools for The Clean Life and Love the Environment Education,BL Putro,,,,,https://scholar.archive.org/work/s2hz2a2c3jc27cqabaaivbafui/access/wayback/https://eudl.eu/pdf/10.4108/eai.12-10-2019.2296317,"BL Putro, RRJP Waslaluddin, H Sutarno - 2020 - scholar.archive.org",0
Comparative performance between C4. 5 and Naive Bayes classifiers in predicting student academic performance in a Virtual Learning Environment,U Pujianto,,,,,https://ieeexplore.ieee.org/abstract/document/8693928/,"EN Azizah, U Pujianto, E Nugraha - 2018 4th International …, 2018 - ieeexplore.ieee.org",11
Implementasi Algoritma AES 128 dan SHA–256 dalam Pengkodean pada Sebagian Frame Video CCTV MPEG-2,EP Nugroho,,,,,http://jatikom.cs.upi.edu/index.php/jatikom/article/view/11,"AY Mulyadi, EP Nugroho… - JATIKOM: Jurnal Aplikasi …, 2018 - jatikom.cs.upi.edu",2
PENERAPAN STRATEGI PEMBELAJARAN TANDUR UNTUK MENINGKATKAN HASIL BELAJAR SISWA PADAMATA PELAJARAN TEKNOLOGI INFORMASI DAN …,EA Nurdin,,,,,http://jurnal.upi.edu/ptik-ilkom/view/811/PENERAPAN%20STRATEGI%20PEMBELAJARAN%20TANDUR%20UNTUK%20MENINGKATKAN%20HASIL%20BELAJAR%20SISWA%20PADAMATA%20PELAJARAN%20TEKNOLOGI%20INFORMASI%20DAN%20KOMUNIKASI,"EA Nurdin, RAO Wahyudin - ptik-ilkom, 2011 - jurnal.upi.edu",1
Implementasi Pbi Pada Media Berbasis Game Untuk Peningkatan Kognitif Siswa Pada Pemrograman Dasar,EP Nugroho,,,,,http://publikasi.dinus.ac.id/index.php/semnastik/article/view/3000,"EP Nugroho, M Gustiani… - SEMINAR NASIONAL …, 2019 - publikasi.dinus.ac.id",0
Research classification in strategic information system planning development: A critical review,A Wahyudin,ZA Hasibuan,,,,https://ieeexplore.ieee.org/abstract/document/7407819/,"A Wahyudin, ZA Hasibuan - 2015 International Conference on …, 2015 - ieeexplore.ieee.org",14
PENERAPAN METODE HILL CLIMBING UNTUK MENENTUKAN MENU MAKANAN BERDASARKAN PENYAKIT YANG DIDERITA,A Wahyudin,,,,,http://jurnal.upi.edu/tik/view/977/PENERAPAN%20METODE%20HILL%20CLIMBING%20UNTUK%20MENENTUKAN%20MENU%20MAKANAN%20BERDASARKAN%20PENYAKIT%20YANG%20DIDERITA,"W Setiawan, A Wahyudin, H Desiana - tik, 2011 - jurnal.upi.edu",0
LAGU-LAGU KERONCONG PERJUANGAN INDONESIA 1942-1946,,,,,,http://repository.upi.edu/id/eprint/21205,IE Nugraha - 2016 - repository.upi.edu,0
RANCANG BANGUN SISTEM PENDUKUNG KEPUTUSAN PENENTUAN TEMA SKRIPSI MENGGUNAKAN METODE TECHNIQUE FOR ORDER PREFERENCE BY …,,,,,,http://jurnal.upi.edu/tik/view/974/RANCANG%20BANGUN%20SISTEM%20PENDUKUNG%20KEPUTUSAN%20PENENTUAN%20TEMA%20SKRIPSI%20MENGGUNAKAN%20METODE%20TECHNIQUE%20FOR%20ORDER%20PREFERENCE%20BY%20SIMILARITY%20TO%20IDEAL%20SOLUTION%20(TOPSIS)%20PADA%20PROGRAM%20STUDI%20ILMU%20KOMPUTER,"AW Rasim, R Aperian - tik, 2011 - jurnal.upi.edu",0
EFEKTIVITAS PENGGUNAAN METODE EKSPERIMEN VERIFIKASI BERBASIS MULTIMEDIA INTERAKTIF TERHADAP HASIL BELAJAR SISWA PADA MATA …,EAN Munir,,,,,http://jurnal.upi.edu/ptik-ilkom/view/815/EFEKTIVITAS%20PENGGUNAAN%20METODE%20EKSPERIMEN%20VERIFIKASI%20BERBASIS%20MULTIMEDIA%20INTERAKTIF%20TERHADAP%20HASIL%20BELAJAR%20SISWA%20PADA%20MATA%20PELAJARAN%20TIK(Studi%20Kasus%20Eksperimen%20di%20SMAN%202%20Cimahi),"EAN Munir - ptik-ilkom, 2011 - jurnal.upi.edu",0
PENGEMBANGAN SISTEM E LEARNING BERBASIS KURIKULUM TINGKAT SATUAN PENDIDIKAN,EA Nurdin,M Suryani,,,,http://jurnal.upi.edu/ptik-ilkom/view/817/PENGEMBANGAN%20SISTEM%20E-LEARNING%20BERBASIS%20KURIKULUM%20TINGKAT%20SATUAN%20PENDIDIKAN,"H Wara, EA Nurdin, M Suryani - ptik-ilkom, 2011 - jurnal.upi.edu",0
PENGUKURAN STATUS KESEHATAN MASYARAKAT BERDASARKAN KECUKUPAN GIZI DENGAN MENGGUNAKAN METODE FUZZY LOGIC,AW Wahyudin,,,,,http://jurnal.upi.edu/tik/view/975/PENGUKURAN%20STATUS%20KESEHATAN%20MASYARAKAT%20BERDASARKAN%20KECUKUPAN%20GIZI%20DENGAN%20MENGGUNAKAN%20METODE%20FUZZY%20LOGIC,"AW Wahyudin, DA Afriliandy - tik, 2011 - jurnal.upi.edu",0
STUDI KOMPARASI ANTARA HASIL BELAJAR TIK MENGGUNAKAN METODE INKUIRI TERBIMBING DENGAN METODE DEMONSTRASI,EA Nurdin,,,,,http://jurnal.upi.edu/ptik-ilkom/view/818/STUDI%20KOMPARASI%20ANTARA%20HASIL%20BELAJAR%20TIK%20MENGGUNAKAN%20METODE%20INKUIRI%20TERBIMBING%20DENGAN%20METODE%20DEMONSTRASI,"EA Nurdin, EW Rasim - ptik-ilkom, 2011 - jurnal.upi.edu",0
PENGARUH TAHAPAN SHARE DAN REFLECT PADA METODE PEMBELAJARAN CREATIVE LEARNING CYCLE TERHADAP PENCAPAIAN KEAHLIAN ABAD KE …,A Anisyah,,,,,http://repository.upi.edu/id/eprint/23243,A Anisyah - 2016 - repository.upi.edu,0
Sistem pendukung keputusan penyusunan prioritas perbaikan standar akreditasi program studi menggunakan metode AHP dan Promethee,J Kusnedar,,,,,http://jatikom.cs.upi.edu/index.php/jatikom/article/view/13,"KD Saptarena, J Kusnedar… - JATIKOM: Jurnal Aplikasi …, 2018 - jatikom.cs.upi.edu",1
Microscopic observation of solid-liquid reaction: A novel laboratory approach to teaching rate of reaction,A Setiabudi,A Wahyudin,G Yuliani,,,https://espace.curtin.edu.au/handle/20.500.11937/52817,"A Setiabudi, A Wahyudin, G Yuliani… - Indonesian Journal of …, 2017 - espace.curtin.edu.au",0
Rancang Bangun Aplikasi IS and Business Alignment Maturity Level sebagai Dasar Perencanaan Strategis Sistem Informasi Organisasi,A Wahyudin,,,,,http://jatikom.cs.upi.edu/index.php/jatikom/article/view/25,"A Jatikom, R Desmayanti, A Wahyudin… - … : Jurnal Aplikasi dan …, 2018 - jatikom.cs.upi.edu",0
"Analysis on atmospheric pressure, temperature, and wind speed profiles during total solar eclipse 9 March 2016 using time series clustering",LS Riza,Y Wihardi,EA Nurdin,ND Ardi,,https://iopscience.iop.org/article/10.1088/1742-6596/771/1/012009/meta,"LS Riza, Y Wihardi, EA Nurdin, ND Ardi… - Journal of Physics …, 2016 - iopscience.iop.org",8
PENGEMBANGAN MODEL SISTEM ELEARNING KOMUNITAS DENGAN PENDEKATAN PERSONAL LEARNING ENVIRONMENTS (PLEs),EP Nugroho,Y Wibisono,,,,http://file.upi.edu/Direktori/JURNAL/PENDIDIKAN_TIK/Jurnal_Pend_TIK_Vol_2_No_2/PENGEMBANGAN_MODEL_SISTEM_ELEARNING_KOMUNITAS_DENGAN_PENDEKATAN_PERSONAL_LEARNING_ENVIRONMENTS_(PLEs).pdf,"AS Tsauri, EP Nugroho, Y Wibisono - Jurnal Pendidikan Teknologi …, 2009 - file.upi.edu",1
Leadership and culture of data governance for the achievement of higher education goals (Case study: Indonesia University of Education),BL Putro,K Surendro,Herbert,,,https://aip.scitation.org/doi/abs/10.1063/1.4941160,"BL Putro, K Surendro, Herbert - AIP Conference Proceedings, 2016 - aip.scitation.org",6
A Review of Intrusion Detection System in IoT with Machine Learning Approach: Current and Future Research,EP Nugroho,T Djatna,IS Sitanggang,,,https://ieeexplore.ieee.org/abstract/document/9392075/,"EP Nugroho, T Djatna, IS Sitanggang… - … on Science in …, 2020 - ieeexplore.ieee.org",0
Penerapan Model Pembelajaran Project Based Learning (PjBL) untuk Meningkatkan Keaktifan Belajar Siswa pada Mata Pelajaran Pemodelan Perangkat Lunak …,W Setiawan,EF Rahman,,,,https://ejournal.upi.edu/index.php/JGrKom/article/view/29480,"RR Agustriyanda, W Setiawan, EF Rahman… - Jurnal Guru …, 2020 - ejournal.upi.edu",0
ATRIBUT PRODUK PENSIL 2B STAEDTLER SERTA PENGARUHNYA TERHADAP KEPUTUSAN PEMBELIAN,,,,,,http://repository.upi.edu/id/eprint/4405,EY Nugraha - 2013 - repository.upi.edu,3
Pengaruh Model Pembelajaran Project Base Learning Melalui Pembelajaran Daring Pada Mata Pelajaran Pemrograman Web dan Perangkat Bergerak Terhadap …,EA Nurdin,EF Rahman,,,,https://ejournal.upi.edu/index.php/JGrKom/article/view/29505,"M Dafit, BN Praja, EA Nurdin, EF Rahman - Jurnal Guru Komputer, 2020 - ejournal.upi.edu",0
The K-Means Algorithm for Generating Sets of Items in Educational Assessment,LS Riza,,,,,https://ejournal.upi.edu/index.php/ijost/article/view/31523,"LS Riza, RA Rosdiyana, AR Pérez… - Indonesian Journal of … - ejournal.upi.edu",1
Deteksi Topik Fashion Pada Twitter Dengan Latent Dirichlet Allocation,Y Wibisono,BL Putro,,,,http://jatikom.cs.upi.edu/index.php/jatikom/article/view/14,"YU Al-khairi, Y Wibisono, BL Putro - JATIKOM: Jurnal Aplikasi …, 2018 - jatikom.cs.upi.edu",1
PRE-SERVICE TEACHERS'DIGITAL LITERACY: A LEAP IN TIME,W Setiawan,A Abdulkarim,E Nugraha,,,https://ejournal.upi.edu/index.php/jpmipa/article/view/13907,"W Setiawan, A Abdulkarim, E Nugraha - Jurnal Pengajaran MIPA - ejournal.upi.edu",1
THE USE OF SMART AND WEBGIS VISUALIZATION METHODS IN RECOMMENDING REGIONS THAT REQUIRE CLEAN WATER SUPPLY,,,,,,http://jestec.taylors.edu.my/Vol%2015%20issue%201%20February%202020/15_1_24.pdf,"NS FITRIASARI, M NOVITASARI… - Journal of …, 2020 - jestec.taylors.edu.my",0
Blended learning in postgraduate program,AP Wibawa,,,,,https://ieeexplore.ieee.org/abstract/document/8257164/,"CW Ilahi, DAF Rizky, AP Wibawa… - 2017 3rd International …, 2017 - ieeexplore.ieee.org",2
A Collaborative Process Scheme in Strategic Information Systems Planning,A Wahyudin,HB Santoso,,,,https://ieeexplore.ieee.org/abstract/document/8780415/,"A Wahyudin, HB Santoso… - 2018 Third International …, 2018 - ieeexplore.ieee.org",0
PENERAPAN MODEL PEMBELAJARAN MODIFIED INQUIRY UNTUK MENINGKATKAN HASIL BELAJAR SISWAPADA MATA PELAJARAN TIK,R Amalia,,,,,http://jurnal.upi.edu/penelitian-pendidikan/view/812/PENERAPAN%20MODEL%20PEMBELAJARAN%20MODIFIED%20INQUIRY%20UNTUK%20MENINGKATKAN%20HASIL%20BELAJAR%20SISWAPADA%20MATA%20PELAJARAN%20TIK,"EAN Rasim, R Amalia - penelitian-pendidikan, 2011 - jurnal.upi.edu",1
Business-information systems strategic alignment readiness maturity level: Corporate and business-technology driver perspective,A Wahyudin,HB MUNIR,,,,https://www.researchgate.net/profile/Asep-Wahyudin-2/publication/342586915_Business-Information_Systems_Strategic_Alignment_Readiness_Maturity_Level_Corporate_and_Business-Technology_Driver_Perspective/links/5efbf39c92851c52d60c92b2/Business-Information-Systems-Strategic-Alignment-Readiness-Maturity-Level-Corporate-and-Business-Technology-Driver-Perspective.pdf,"A Wahyudin, R Desmayanti, HB MUNIR… - Journal of …, 2019 - researchgate.net",0
Development of Student Attendance Reporting System Using WhatsApp Gateway with Android-Based Broadcasting Method,EA Nurdin,,,,,https://www.researchgate.net/profile/Enjang-Ali-Nurdin/publication/345481329_Development_of_Student_Attendance_Reporting_System_Using_WhatsApp_Gateway_with_Android-Based_Broadcasting_Method/links/5facf60d299bf18c5b6a0eea/Development-of-Student-Attendance-Reporting-System-Using-WhatsApp-Gateway-with-Android-Based-Broadcasting-Method.pdf,"EA Nurdin, DM Wahyudin - 2020 - researchgate.net",0
Burnout and mobbing in IT students,AP Wibawa,E Nugraha,,,,https://ieeexplore.ieee.org/abstract/document/8257161/,"JA Fauzi, AP Wibawa, E Nugraha - 2017 3rd International …, 2017 - ieeexplore.ieee.org",0
Comparing the characteristics of undergraduate program of information system in public and private universities,U Kholifah,AP Wibawa,,,,https://ieeexplore.ieee.org/abstract/document/8257160/,"U Kholifah, RH Dini, AP Wibawa… - 2017 3rd International …, 2017 - ieeexplore.ieee.org",1
The Use of Design Pattern on Informatics Engineering Students Thesis,AP Wibawa,,,,,https://www.atlantis-press.com/article/25905046.pdf,"AD Aindra, OP Suryoningtyas, AP Wibawa… - 2018 - atlantis-press.com",0
Strategi Pembelajaran Just In Time Teaching,EF Rahman,EA Nurdin,,,,http://jurnal.upi.edu/penelitian-pendidikan/view/810/Strategi%20Pembelajaran%20Just%20in%20Time%20Teaching,"EF Rahman, EA Nurdin, AF Atsarak - penelitian-pendidikan, 2011 - jurnal.upi.edu",0
PENERAPAN STRATEGI PEMBE,EA Nurdin,,,,,http://jurnal.upi.edu/find/view/811/PENERAPAN%20STRATEGI%20PEMBE,"EA Nurdin, RAO Wahyudin - find, 2011 - jurnal.upi.edu",0
Analysis Collaborative Online Judge and Learning Methods for Programming Subject,RA Sukamto,EF Rahman,,,,https://www.researchgate.net/profile/Rosa-Sukamto/publication/284165967_Analysis_Collaborative_Online_Judge_and_Learning_Methods_for_Programming_Subject/links/564d2e3208ae4988a7a42c88/Analysis-Collaborative-Online-Judge-and-Learning-Methods-for-Programming-Subject.pdf,"RA Sukamto, EF Rahman - researchgate.net",0
Sistem Reporting Keamanan pada Jaringan Cloud Computing Melalui bot Telegram dengan Menggunakan Teknik Intrussion Detection and Prevention System,EP Nugroho,,,,,https://journal.nurulfikri.ac.id/index.php/JTT/article/view/233,"EP Nugroho - Jurnal Teknologi Terpadu, 2019 - journal.nurulfikri.ac.id",2
Parallel Exponential Smoothing Using the Bootstrap Method in R for Forecasting Asteroid's Orbital Elements.,LS Riza,JA Utama,,,,http://search.ebscohost.com/login.aspx?direct=true&profile=ehost&scope=site&authtype=crawler&jrnl=01287680&AN=128402737&h=v%2FQ%2FaDGmog835UWu%2F1m1XFSHhp%2Fdnyfy6hf6LmOS3PSOz6ftB2O9b5LEsquUL03GVDNI3qFYOq1Gv3HD3ROmfw%3D%3D&crl=c,"LS Riza, JA Utama, SM Putra… - Pertanika Journal of …, 2018 - search.ebscohost.com",9
MetaheuristicOpt: An R Package for Optimisation Based on Meta-Heuristics Algorithms.,LS Riza,EP Nugroho,,,,http://search.ebscohost.com/login.aspx?direct=true&profile=ehost&scope=site&authtype=crawler&jrnl=01287680&AN=131365958&h=mr6N256a36HL3u3QPyLMPHQd7NHYSj3viRpnlJf%2BOeMo19l4Gwoc7QsFxT2Oz%2FBI%2Bmc43pV%2FFNqjBZ7H0zI3Gg%3D%3D&crl=c,"LS Riza, EP Nugroho - Pertanika Journal of Science & …, 2018 - search.ebscohost.com",6
Development of online learning groups based on MBTI learning style and fuzzy algorithm,BL Putro,Y Rosmansyah,,,,https://search.proquest.com/openview/ce2bc1c681020276e0ae2fe89f2afa24/1?pq-origsite=gscholar&cbl=376296,"BL Putro, Y Rosmansyah - Telkomnika, 2020 - search.proquest.com",1
"TEACHING, LEARNING AND SHARING BASED WEB-LEARNING WITH EVFA",EA Nurdin,,,,,https://www.kosen-k.go.jp/Portals/0/kokusai/ISATE/Proceeding/2014-9Other.pdf,"EA Nurdin, AABA Santoso - kosen-k.go.jp",0
Aplikasi Produksi Teh Berbasis Web pada PT Maskapai Indorub Sumber Wadung,R Yuliana,BL Putro,HP Utomo,,,https://journals.telkomuniversity.ac.id/jti/article/view/440,"R Yuliana, BL Putro, HP Utomo - Jurnal Teknologi …, 2012 - journals.telkomuniversity.ac.id",0
DESAIN DAN IMPLEMENTASI COMPUTERIZED ADAPTIVE TEST DENGAN E-PSIKOMETRIK,R Risnandar,SD Budiwati,EP Nugroho,,,http://seminar.bsi.ac.id/snit/index.php/snit-2014/article/view/183,"R Risnandar, SD Budiwati, EP Nugroho - SNIT 2014, 2014 - seminar.bsi.ac.id",0
Sistem Informasi,A Wahyudin,,,,,http://file.upi.edu/Direktori/FPMIPA/PRODI._ILMU_KOMPUTER/197112232006041-ASEP_WAHYUDIN/Isu%20Etika%20Profesi.pdf,"A Wahyudin, S Kom, MTI Komputer - … dan Konsep SI.[Online] Available at, 2010 - file.upi.edu",2

















































































PENERAPAN MODEL CREATIVE PROBLEM SOLVING UNTUK MENINGKATKAN KEMAMPUAN BERPIKIR KREATIF SISWA DALAM MATA PELAJARAN IPA SD …,,,,,,http://repository.upi.edu/id/eprint/32260,R Erlangga - 2018 - repository.upi.edu,0
PENGEMBANGAN FRAMEWORK MOBILE LEARNING PADA PERTANIAN SAYURAN,E Erlangga,H Siregar,Y Wihardi,,,https://www.jurnal.stmik-mi.ac.id/index.php/jcb/article/view/200,"E Erlangga, H Siregar, Y Wihardi - Jurnal Computech & Bisnis, 2020 - jurnal.stmik-mi.ac.id",0
PENERAPAN MODEL INKUIRI FORMAT DIVERGENT DALAM PEMBELAJARAN PENCAK SILAT DI SEKOLAH DASAR Penelitian Tindakan kelas pada siswa kelas V,,,,,,http://repository.upi.edu/id/eprint/47033,B Erlangga - 2019 - repository.upi.edu,0
ANALISIS PERBANDINGAN PERSEPSI TAMU MANCANEGARA DENGAN TAMU NUSANTARA TERHADAP HOTEL YANG BERKONSEP GREEN HOTEL DI KOTA …,,,,,,http://repository.upi.edu/id/eprint/24674,TF Erlangga - 2017 - repository.upi.edu,0
MODÉL ÉXPLICIT INTRUCTIONDINA PANGAJARAN MACA CARPON,,,,,,http://repository.upi.edu/id/eprint/13952,I Erlangga - 2014 - repository.upi.edu,0
SEMANGAT KEWIRAUSAHAAN DI PERGURUAN TINGGI (The 5pirit OF Entrepreneurship),H Erlangga,,,,,http://repository.unpas.ac.id/id/eprint/51163,"H Erlangga, S Sos - 2018 - repository.unpas.ac.id",4
KETERLIBATAN STAKEHOLDER DALAM STRATEGI PERENCANAAN PENDIDIKAN PADA PERGURUAN TINGGI SWASTA: Studi Kasus pada Pengembangan …,H Erlangga,,,,,http://repository.upi.edu/id/eprint/1260,H Erlangga - 2013 - repository.upi.edu,2
Spirit Pengembangan Kewirausahaan Di Perguruan Tinggi,H Erlangga,,,,,http://www.journal.unpas.ac.id/index.php/paradigmapolistaat/article/view/1304,"H Erlangga - Paradigma POLISTAAT: Jurnal Ilmu Sosial dan …, 2018 - journal.unpas.ac.id",7
Mini Roller Coaster (Miroco) sebagai Media untuk Menghitung Percepatan Ditinjau dari Energi Mekanik,H Saputro,,,,,https://journal.fisika.or.id/index.php/rf/article/view/80,"SY Erlangga, H Saputro - Risalah Fisika, 2018 - journal.fisika.or.id",2
Adsorption isotherm characteristics of calcium carbonate microparticles obtained from barred fish (Scomberomorus spp.) bone using two-parameter multilayer …,ABD Nandiyanto,,,,,http://103.86.130.60/handle/123456789/69582,"ABD Nandiyanto, TMS Erlangga, G Mufidah… - 2020 - 103.86.130.60",1
The Spirit Of The Development Of Entrepreneurship In Higher Education,H Erlangga,,,,,https://proceedings.conference.unpas.ac.id/index.php/oneasia/article/view/456,"H Erlangga - International Conference of One …, 2019 - proceedings.conference.unpas.ac.id",1
