Title,Author1,Author2,Author3,Author4,Author5,Link,Summary,Cited By
Learning Model Development to Improve Students' Oral Communication Skill,L Lukman,I Abdulhak,D Wahyudin,,,https://core.ac.uk/download/pdf/230594612.pdf,"L Lukman, I Abdulhak, D Wahyudin - International Journal of Linguistics … - core.ac.uk",0
Taboo in Banjarese Culture,R Sholihin,,,,,http://journal.iaingorontalo.ac.id/index.php/au/article/view/1396,"R Sholihin, A Asmaran, W Wahyudin, B Badrian… - Al …, 2020 - journal.iaingorontalo.ac.id",0
AI programming by children using snap! block programming in a developing country,KM Kahn,R Megasari,E Piantari,E Junaeti,,https://ecraft2learn.github.io/ai/publications/EC-TEL_2018_source-files_48%20kk%20edits%20changes%20accepted.pdf,"KM Kahn, R Megasari, E Piantari, E Junaeti - 2018 - ecraft2learn.github.io",24
Trade Union leader executed in secret,,,,,,https://vuir.vu.edu.au/id/eprint/26274,M Munir - vuir.vu.edu.au,0
E-LEARNING: KONSEP DAN DESAIN TEKNOLOGI INFORMASI DALAM PENDIDIKAN,M Munir,,,,,http://file.upi.edu/Direktori/FPMIPA/PRODI._ILMU_KOMPUTER/196603252001121-MUNIR/Artikel_TIK/Seminar_TIK_di_Matematika.pdf,M Munir - file.upi.edu,0
Peramalan Hasil Produksi Sandal Dan Penjualan Menggunakan Metode Interpolasi (Inverse Distance Weighting) IDW,T Yulianto,,,,,https://proceeding.uim.ac.id/index.php/nacomse/article/view/159,"M Munir, T Yulianto, F Faisol - National Conference on …, 2018 - proceeding.uim.ac.id",1
PEMBINAAN KOMPETENSI SISWA UNTUK LOMBA KETERAMPlLAN SISWA BIDANG ELECTRONICAPPLICATIONS,,,,,,https://journal.uny.ac.id/index.php/ptbb/article/view/43103,"M Munir, F Fatchurrohman - Prosiding Pendidikan Teknik Boga …, 2010 - journal.uny.ac.id",0
Analisis pengembangan media pembelajaran pengolah angka (spreadsheet) berbasis video screencast,M Munir,,,,,https://journal.uny.ac.id/index.php/jptk/article/view/9457,"M Munir - Jurnal Pendidikan Teknologi dan Kejuruan, 2013 - journal.uny.ac.id",9
"KARAKTER"" KONSELOR PROFESIONAL"" AKTUAL DAN IDEAL MAHASISWA PRODI BIMBINGAN-KONSELING FIP UNIMED BERBASIS STANDARISASI PAKAR",A Murad,,,,,http://digilib.unimed.ac.id/id/eprint/35430,"A Menanti, A Munir, A Murad… - … Profesional"" Aktual dan …, 2015 - digilib.unimed.ac.id",1
Penggunaan teknik role playing untuk mengurangi perilaku bullying siswa kelas XII MIA SMA Negeri 5 Palu,A Munir,,,,,https://scholar.archive.org/work/ai6pxqq66vhdrhe5voobywnoui/access/wayback/http://jurnal.untad.ac.id/jurnal/index.php/JKP/article/viewFile/6265/4971,"R Prihatin, A Munir - Jurnal Konseling & psikoedukasi, 2016 - scholar.archive.org",5
MANAJEMEN PEMBELAJARAN BERBASIS MULTIPLE INTELLIGENCE,D Setiardi,,,,,https://repository.bbg.ac.id/handle/717,"D Setiardi, MM Munir, N Rohman - … PENDIDIKAN DASAR 2018, 2018 - repository.bbg.ac.id",0
Pendampingan Calon Konselor dalam Mereduksi Kecemasan pada Anak Korban Kekerasan Seksual di Pusat Pelayanan Terpadu (PPT) Jawa Timur Tahun 2018,,,,,,http://proceedings.uinsby.ac.id/index.php/ACCE/article/view/94,"A Amriana, M Munir - Proceedings of Annual Conference …, 2018 - proceedings.uinsby.ac.id",0
Model Manajemen Mutu Terpadu Berbasis Multiple Intelegence Pada Sekolah Dasar Unggulan Di Kabupaten Jepara,D Setiardi,,,,,https://www.jurnal.umk.ac.id/index.php/RE/article/view/2814,"D Setiardi, MM Munir - Refleksi Edukatika: Jurnal Ilmiah …, 2018 - jurnal.umk.ac.id",2
PENERAPAN MODEL PEMBELAJARAN KOOPERATIF TIPE TEAM GAMES TOURNAMENT (TGT) UNTUK MENINGKATKAN HASIL BELAJAR BAHASA INGGRIS …,,,,,,https://eprints.umm.ac.id/30871/,F MUNIR N - 2011 - eprints.umm.ac.id,0
… BERBASIS DINAMIS BERBASIS GAME: PROYEK KOLABORATIF ANTARA UNIVERSITAS ASUMSI (UA) DAN UNIVERSITAS PENDIDIKAN INDONESIA (UPI),W Setiawan,S Fatimah,J Kusnendar,,,http://file.upi.edu/Direktori/FPMIPA/PRODI._ILMU_KOMPUTER/196601011991031-WAWAN_SETIAWAN/Folder%20Baru/Paper%20GT%202018-2a.pdf,"W Setiawan, S Fatimah, J Kusnendar - file.upi.edu",0
Studi pemanfaatan ekstrak kunyit (Curcuma domestica Valeton) untuk pengendalian penyakit jamur akar putih pada tanaman karet,APJ Kusdiana,M Munir,,,,https://www.researchgate.net/profile/Alchemi-Putri-Juliantika-Kusdiana/publication/309753095_STUDI_PEMANFAATAN_EKSTRAK_KUNYIT_Curcuma_domestica_Valeton_UNTUK_PENGENDALIAN_PENYAKIT_JAMUR_AKAR_PUTIH_PADA_TANAMAN_KARET/links/589c1704a6fdcc754174391a/STUDI-PEMANFAATAN-EKSTRAK-KUNYIT-Curcuma-domestica-Valeton-UNTUK-PENGENDALIAN-PENYAKIT-JAMUR-AKAR-PUTIH-PADA-TANAMAN-KARET.pdf,"APJ Kusdiana, M Munir… - Jurnal Warta …, 2016 - researchgate.net",9
Implementasi Kurikulum Berbasis English For Specific Purposes Pada Mahasiswa Batam Tourism Polytechnic (BTP),D Wahyudin,,,,,http://journal2.um.ac.id/index.php/jktpk/article/view/15569,"S Lubis, D Wahyudin, R Rusman - Ilmu Pendidikan: Jurnal Kajian …, 2020 - journal2.um.ac.id",0
"Manajemen Pembiayaan Pendidikan (Pendekatan Prinsip Efisiensi, Efektivitas, Transparansi Dan Akuntabilitas)",HUR Wahyudin,,,,,https://books.google.com/books?hl=en&lr=&id=q4Q8EAAAQBAJ&oi=fnd&pg=PP1&dq=upi+%27Munir%27+OR+%27Nusuki+Syariati+Fathimah%27+OR+%27Rani+Megasari%27+OR+%27Rasim%27+OR+%27Rizky+Rahman+J.%27+OR+%27Rosa+Ariani+Sukamto%27+OR+%27Wahyudin%27+OR+%27Wawan+Setiawan%27+OR+%27Yaya+Wihardi%27&ots=XAG8n1qJTW&sig=i4QwtwFPh87C1EHUU1BDgnlSqUE,"HUR Wahyudin, MP MM - 2021 - books.google.com",1
Studi Analisis Kebutuhan Terhadap Pengembangan Model Blended Learning Pada Sistem Pendidikan Jarak Jauh Untuk Meningkatkan Kompetensi Lulusan,D Thaib,D Wahyudin,Y Rahmawati,,,https://ejournal.upi.edu/index.php/eduhumaniora/article/view/5133,"D Thaib, D Wahyudin, Y Rahmawati… - … Jurnal Pendidikan Dasar …, 2016 - ejournal.upi.edu",10
"Strategi Peningkatan Produktivitas Usahatani Padi Sawah (Oriza Sativa, L) Untuk Meningkatkan Ketahanan Pangan Di Kecamatan Pante Bidari Kabupaten Aceh …",T Mahyuddin,,,,,https://ejurnalunsam.id/index.php/psn/article/view/2093,"M Munir, T Mahyuddin - Prosiding Seminar Nasional Pertanian, 2019 - ejurnalunsam.id",0
Komponen kurikulum 2013 Fikih Siyasah Madrasah Aliyah Kelas XII perspektif Civic Education,,,,,,http://digilib.uinsby.ac.id/id/eprint/49377,M Munir - 2019 - digilib.uinsby.ac.id,0
ANALISIS INTERNALISASI NILAI-NILAI ENTREPRENEURSHIP PADA MAHASISWA JURUSAN EKONOMI PEMBANGUNAN DALAM MATA KULIAH …,S Munir,KD Yuangga,,,,https://pgpaud.unirow.ac.id/journal/index.php/oportunitas/article/view/133,"S Munir, KD Yuangga - OPORTUNITAS: Jurnal Pendidikan …, 2020 - pgpaud.unirow.ac.id",1
Analisis hasil pengamatan hilal Badan Meteorologi Klimatologi dan Geofisika (BMKG) Pusat pada tahun 2010 M–2015 M,,,,,,http://eprints.walisongo.ac.id/5757/,B Munir - 2016 - eprints.walisongo.ac.id,2
Digital Literacy Test: Development of Multiple Choice Test for Preservice Physics Teachers,R Rizal,D Rusdiana,W Setiawan,,,https://www.researchgate.net/profile/Rahmat-Rizal-2/publication/341264530_Digital_Literacy_Test_Development_of_Multiple_Choice_Test_for_Preservice_Physics_Teachers/links/5eb61c76299bf1287f77e545/Digital-Literacy-Test-Development-of-Multiple-Choice-Test-for-Preservice-Physics-Teachers.pdf,"R Rizal, D Rusdiana, W Setiawan… - International Journal of …, 2020 - researchgate.net",4
ANALISIS KUALITAS BELAJAR MAHASISWA DALAM PENERAPAN TEKNIK SCAFFOLDING PADA PEMBELAJARAN,NP Munir,,,,,http://www.journal.uncp.ac.id/index.php/Pedagogy/article/view/952,"A Anas, NP Munir - Pedagogy: Jurnal Pendidikan Matematika, 2018 - journal.uncp.ac.id",0
Pengembangan Perangkat Pembelajaran Berdasarkan Masalah Pada Materi Program Linier Kelas XII,T Widodo,,,,,https://journal.unnes.ac.id/sju/index.php/ujmer/article/view/27,"M Munir, T Widodo - Unnes Journal of Mathematics Education …, 2012 - journal.unnes.ac.id",5
Upkabs: A prototype app to extract internal data potential for future interest,H Siregar,RA Sukamto,,,,https://ieeexplore.ieee.org/abstract/document/8257207/,"H Siregar, RA Sukamto… - 2017 3rd International …, 2017 - ieeexplore.ieee.org",0
JURUSAN TEKNIK MESIN FAKULTAS TEKNIK UNIVERSITAS MUHAMMADIYAH SURAKARTA,,,,,,https://core.ac.uk/download/pdf/148610331.pdf,"PVP PUTARAN, TH PENGERINGAN, I WAHYUDIN - core.ac.uk",0
Higher Education Policy Strategy in Acceleration of Research Results Publication,H Sugilar,T Priatna,W Darmalaksana,,,http://digilib.uinsgd.ac.id/id/eprint/16591,"H Sugilar, T Priatna, W Darmalaksana - 2017 - digilib.uinsgd.ac.id",3
Sistem Informasi,A Wahyudin,,,,,http://file.upi.edu/Direktori/FPMIPA/PRODI._ILMU_KOMPUTER/197112232006041-ASEP_WAHYUDIN/Isu%20Etika%20Profesi.pdf,"A Wahyudin, S Kom, MTI Komputer - … dan Konsep SI.[Online] Available at, 2010 - file.upi.edu",2
Pengaruh Menonton Tayangan Televisi Terhadap Perilaku Agresif Pada Anak Prasekolah,Z Munir,,,,,https://www.ejournal.unuja.ac.id/index.php/jkp/article/view/509,"AD Atmoko, Z Munir… - Jurnal Keperawatan …, 2019 - ejournal.unuja.ac.id",3
Perilaku Sedimen Melayang Pada Saluran Primer Jaringan Irigasi Bantimurung,,,,,,http://103.195.142.59/uploaded_files/temporary/DigitalCollection/Y2UxNmE2MDZhYmI1YjAzOTE4MmY4NjBiN2EzNGQ0OTFlZDU0MGRhZA==.pdf,"A Agusli, IT Prawitosari, IA Munir, M Eng - 103.195.142.59",0
MODEL PEMBELAJARAN KETERAMPILAN RENANG GAYA BEBAS UNTUK PEMULA KELOMPOK UMUR 4-5 TAHUN,,,,,,https://stkipmutiarabanten.ac.id/wp-content/uploads/2021/06/2_RIFKI-WAHYUDIN.pdf,R Wahyudin - stkipmutiarabanten.ac.id,0
PEMBELAJARAN VOKAL DI SANGGAR BINA VOKALIA HARMONIA KOTA PONTIANAK,H Sanulita,,,,,https://jurnal.untan.ac.id/index.php/jpdpb/article/view/23793,"M Sufriyanti, H Sanulita, A Munir - Jurnal Pendidikan dan Pembelajaran … - jurnal.untan.ac.id",0
PELAKSANAAN READING ALOUD DALAM PEMBELAJARAN AL-QUR'AN HADIS (MATERI POKOK “GEMAR BERSILATURRAHIM”) PADA SISWA KELAS IV DI MI …,,,,,,http://eprints.walisongo.ac.id/id/eprint/6021/,M MUNIR - eprints.walisongo.ac.id,0
Analisis Kurikulum: Studi Komparatif Pengembangan Kurikulum di Jepang dan Indonesia,D Wahyudin,,,,,https://ejournal.upi.edu/index.php/JIK/article/view/35610,D Wahyudin - Inovasi Kurikulum - ejournal.upi.edu,0
Graduates Profile Mapping based on Job Vacancy Information Clustering,R Megasari,E Piantari,,,,https://ieeexplore.ieee.org/abstract/document/9392067/,"R Megasari, E Piantari… - 2020 6th International …, 2020 - ieeexplore.ieee.org",0
Pelaksanaan reading aloud dalam pembelajaran Al-Qur'an-Hadis (materi pokok “Gemar Bersilaturrahim”) pada siswa kelas IV di MI Miftahul Huda Mijen Semarang …,M Munir,,,,,http://eprints.walisongo.ac.id/6021/,M Munir - 2016 - eprints.walisongo.ac.id,0
Pelatihan Metode Pembelajaran Bahasa Jawa Krama untuk Usia Dini Bagi Guru RA dan MI,DA Wiranti,,,,,https://scholar.archive.org/work/meryu35knvcvvbkxyuxw36fnim/access/wayback/https://ejournal.unisnu.ac.id/JDC/article/download/876/pdf_1,"DA Wiranti, MM Munir - Journal of Dedicators Community, 2019 - scholar.archive.org",0
Development of Computational Story for Teaching Algorithm and Programming,LS Riza,Y Wihardi,,,,https://ieeexplore.ieee.org/abstract/document/8878556/,"LS Riza, IA Aryani, Y Wihardi… - 2018 2nd East …, 2018 - ieeexplore.ieee.org",1
PERSEPSI ANGGOTA MPU ACEH UTARA TENTANG ASPEK PIDANA PADA PENJUALAN PAKAIAN KETAT,B Munir,,,,,https://www.jurnal.ar-raniry.ac.id/index.php/legitimasi/article/view/5856,"B Munir, A Rahmah - … : Jurnal Hukum Pidana dan Politik Hukum, 2019 - jurnal.ar-raniry.ac.id",0
Implementation of CM-SPADE Algorithm In Building Denial of Service Detection System Model Using Snort,EP Nugroho,R Megasari,E Junaeti,,,https://scholar.archive.org/work/ecm6o7ze3rb2rjwbbvpehwnfdi/access/wayback/https://eudl.eu/pdf/10.4108/eai.12-10-2019.2296332,"EP Nugroho, R Megasari, E Junaeti, SR Pribadi - 2020 - scholar.archive.org",0
Hamming Code at Marker-Based Augmented Reality on the Android Platform for Teaching Philosophy of Batik,,,,,,https://ejournal.upi.edu/index.php/JCS/article/view/24943,"W Widyanto, RA Sukamto, AR Pérez… - Journal of Computers for … - ejournal.upi.edu",0
Nilai-Nilai Islam Dalam Bahan Ajar Tematik Makananku Sehat Dan Bergizi: Suatu Konsep Integratif Pembelajaran Di Madrasah Ibtidaiyah,M Munir,,,,,http://ejournal.uin-malang.ac.id/index.php/madrasah/article/view/3326,"M Munir - Madrasah: Jurnal Pendidikan dan …, 2015 - ejournal.uin-malang.ac.id",2
Perbandingan Pemberian Minuman Air Putih dengan Minuman Isotonik Terhadap Pemulihan Denyut Nadi pada Pemain Hoki FIK UNM,S Saharullah,W Wahyudin,,,,http://eprints.unm.ac.id/14825/,"S Saharullah, W Wahyudin, H Hendra - 2017 - eprints.unm.ac.id",0
Peran keluarga dalam membina pengamalan salat fardu bagi remaja di Dusun Paok Lombok Timur Desa Paok Lombok Kecamatan Suralaga Kabupaten Lombok …,,,,,,http://etheses.uinmataram.ac.id/964/,KA Munir - 2019 - etheses.uinmataram.ac.id,1
Faktor-Faktor yang Mempengaruhi Kinerja Guru Akuntansi dengan Motivasi Sebagai Variabel Intervening,A Wahyudin,,,,,https://journal.unnes.ac.id/sju/index.php/eeaj/article/view/42355,"GA Oktyama, A Wahyudin - Economic Education Analysis …, 2020 - journal.unnes.ac.id",0
Kepuasan Pelanggan Dan Pemilihan Jasa Pendidikan,,,,,,http://ejournal.staida-krempyang.ac.id/index.php/intizam/article/view/200,"M Munir - Intizam, Jurnal Manajemen Pendidikan …, 2020 - ejournal.staida-krempyang.ac.id",0
Penggunaan Wi-Fi Direct Untuk Aplikasi Presensi dan Distribusi File,Y Wibisono,Y Wihardi,,,,https://ejournal.upi.edu/index.php/JATIKOM/article/view/33207,"FAF Muslim, Y Wibisono, Y Wihardi - Jurnal Aplikasi dan Teori Ilmu … - ejournal.upi.edu",0
Hubungan Kontrol Diri dan Iklim Sekolah dengan Perilaku Bullying pada Siswa SMP Swasta Budi Agung Medan,I Minauli,,,,,http://repository.uma.ac.id/handle/123456789/13940,"A Munir, I Minauli - 2013 - repository.uma.ac.id",0
Color and texture features extraction on content-based image retrieval,HW Prabawa,,,,,https://ieeexplore.ieee.org/abstract/document/8257205/,"RD Putri, HW Prabawa… - 2017 3rd International …, 2017 - ieeexplore.ieee.org",6
Konten lokal digitalisasi dan Pandemi Covid-19 di Lembaga Penyiaran Jawa Barat,D Fardiah,M Hikmat,A Wahyudin,,,http://digilib.uinsgd.ac.id/38516/,"D Fardiah, M Hikmat, A Wahyudin, D Mardiansyah… - 2018 - digilib.uinsgd.ac.id",0
PENINGKATAN KETERAMPILAN BERMAIN REKORDER MELALUI METODE TUTOR SEBAYA DI SMP,I Fretisari,,,,,https://jurnal.untan.ac.id/index.php/jpdpb/article/view/17934,"I Fretisari, A Munir - Jurnal Pendidikan dan Pembelajaran Khatulistiwa - jurnal.untan.ac.id",1
"The use of Triple Exponential Smoothing Method (Winter) in forecasting passenger of PT Kereta Api Indonesia with optimization alpha, beta, and gamma parameters",W Setiawan,,,,,https://ieeexplore.ieee.org/abstract/document/7852633/,"W Setiawan, E Juniati, I Farida - 2016 2nd International …, 2016 - ieeexplore.ieee.org",19
Model Pengembangan Kurikulum Manajemen: Studi Pada Kurikulum Jurusan Manajemen Fakultas Ekonomi Universitas Islam Negeri (UIN) Maulana Malik Ibrahim …,M Sulhan,F Fitriyah,,,,http://repository.uin-malang.ac.id/2167/,"M Munir, M Sulhan, F Fitriyah - 2015 - repository.uin-malang.ac.id",0
Designing of Environmental Physics Course Instruments about Ocean Wave Energy to Enhance Students' Creative Thinking Skills,M Satriawan,W Setiawan,,,,https://journal.unesa.ac.id/index.php/jpfa/article/view/9343,"M Satriawan, L Liliasari, W Setiawan… - … Penelitian Fisika dan …, 2021 - journal.unesa.ac.id",0
Peran keluarga dalam membina pengamalan salat fardu bagi remaja di Dusun Paok Lombok Timur Desa Paok Lombok Kecamatan Suralaga Kabupaten Lombok …,,,,,,http://etheses.uinmataram.ac.id/id/eprint/379,KA Munir - 2019 - etheses.uinmataram.ac.id,0
Strategi Perguruan Tinggi dalam meningkatkan Publikasi Hasil Penelitian,H Sugilar,T Priatna,,,,http://ojs.iainbatusangkar.ac.id/ojs/index.php/alfikrah/article/view/847,"H Sugilar, T Priatna… - Al-Fikrah: Jurnal …, 2019 - ojs.iainbatusangkar.ac.id",8
A contextual semi assisted project-based learning (SA-PjBL) about ocean wave energy: Creative thinking of pre-service physics teachers,M Satriawan,W Setiawan,,,,https://ejournal.unikama.ac.id/index.php/momentum/article/view/5172,"M Satriawan, L Liliasari, W Setiawan… - Momentum: Physics …, 2021 - ejournal.unikama.ac.id",0
Implementation of cyber-blog system to improving concept understanding in algorithm for students,Y Wihardi,,,,,https://ieeexplore.ieee.org/abstract/document/7407785/,"Y Wihardi, A Agustan - 2015 International Conference on …, 2015 - ieeexplore.ieee.org",4
The Development of 'E-Layer'Android Mobile Application as Interactive Multimedia in Earth Layer Topics for Junior High School,EC Prima,Y Wihardi,,,,https://www.researchgate.net/profile/Eka-Prima-2/publication/343365499_The_Development_of_'E-Layer'_Android_Mobile_Application_as_Interactive_Multimedia_in_Earth_Layer_Topics_for_Junior_High_School/links/5f25740c458515b729f8d1ce/The-Development-of-E-Layer-Android-Mobile-Application-as-Interactive-Multimedia-in-Earth-Layer-Topics-for-Junior-High-School.pdf,"EN Sunarya, EC Prima, Y Wihardi - … Computing Technologies for …, 2020 - researchgate.net",1
Enhancing The User Experience of Portal Website using User-Centered Design Method,Y Wibisono,,,,,https://ieeexplore.ieee.org/abstract/document/9392044/,"RA Sukamto, Y Wibisono - 2020 6th International …, 2020 - ieeexplore.ieee.org",0
Comparison of weighted product method and technique for order preference by similarity to ideal solution method: Complexity and accuracy,,,,,,https://ieeexplore.ieee.org/abstract/document/8257155/,"NS Fitriasari, SA Fitriani… - 2017 3rd International …, 2017 - ieeexplore.ieee.org",15
Development Mobile Learning For Vegetable Farming In Indonesia Based On Mobile Cloud Computing,Y Wihardi,E Nugraha,,,,https://ieeexplore.ieee.org/abstract/document/9392074/,"Y Wihardi, E Nugraha - 2020 6th International Conference on …, 2020 - ieeexplore.ieee.org",0
Pendidikan Pelestarian Lingkungan dalam Prespektif Al-Qur'an,S Munir,,,,,https://repository.ptiq.ac.id/id/eprint/208/,S Munir - 2019 - repository.ptiq.ac.id,0
Unlimited Energy Source: A Review of Ocean Wave Energy Utilization and Its Impact on the Environment,M Satriawan,W Setiawan,,,,https://ejournal.upi.edu/index.php/ijost/article/view/31473,"M Satriawan, L Liliasari, W Setiawan… - Indonesian Journal of … - ejournal.upi.edu",2
Hubungan Antara Self Efficacy dengan Kemandirian Belajar pada Siswa SMK Pertanian Pembangunan Negeri Kutacane,FH Siregar,,,,,http://repository.uma.ac.id/handle/123456789/14013,"A Munir, FH Siregar - 2016 - repository.uma.ac.id",0
Code Comment Assessment Development for Basic Programming Subject using Online Judge,R Megasari,E Piantari,,,,https://scholar.archive.org/work/s5njh73ibzavthrxwlchcdjj4m/access/wayback/https://eudl.eu/pdf/10.4108/eai.12-10-2019.2296547,"RA Sukamto, R Megasari, E Piantari, MNF Rischa - 2020 - scholar.archive.org",0
Impact of audio narrated animation on students' understanding and learning environment based on gender,W Setiawan,,,,,https://aip.scitation.org/doi/abs/10.1063/1.4983975,"AR Nasrudin, W Setiawan… - AIP Conference …, 2017 - aip.scitation.org",1
Facial Expression Recognition on The Classroom Environments,W Setiawan,Y Wihardi,,,,https://scholar.archive.org/work/vyueaazft5h45mn2ciy4dtpoti/access/wayback/https://eudl.eu/pdf/10.4108/eai.12-10-2019.2296519,"W Setiawan, Y Wihardi, E Junateti, NR Faikar - 2020 - scholar.archive.org",0
Determine focus based on eye gazing direction,W Setiawan,M Nursalman,,,,https://ieeexplore.ieee.org/abstract/document/8257179/,"W Setiawan, M Nursalman… - 2017 3rd International …, 2017 - ieeexplore.ieee.org",0
THE IMPLEMENTATION OF PROJECT BASED LEARNING (PjBL) IN TEACHING AND LEARNING ENGLISH AS A FOREIGN LANGUAGE,,,,,,http://repository.upi.edu/id/eprint/26206,W Setiawan - 2016 - repository.upi.edu,0
Anatolia Agency (AA) Turkey's Oldest News Agency,,,,,,https://journals.sagepub.com/doi/pdf/10.1177/001654926401000106,"M Berik - Gazette (Leiden, Netherlands), 1964 - journals.sagepub.com",2
Hubungan Self Eficacy dan Dukungan Sosial Teman Sebaya dengan Self Regulated Learning Mahasiswa Universitas Potensi Utama Medan,A Aziz,,,,,http://repository.uma.ac.id/handle/123456789/14135,"A Munir, A Aziz - 2017 - repository.uma.ac.id",0
Meningkatkan pemahaman dan retensi siswa melalui pembelajaran berbasis teknologi multimedia interaktif,W Setiawan,,,,,http://file.upi.edu/Direktori/FPMIPA/PRODI._ILMU_KOMPUTER/196601011991031-WAWAN_SETIAWAN/10._Peningkatan_Pemahaman_dan_Retensi_Baru.pdf,"F Tapilouw, W Setiawan - Jurnal pendidikan teknologi informasi dan …, 2008 - file.upi.edu",26
Kekuatan pernyataan visi dan misi konvensional dan Islam serta hubungannya dengan pengembangan program dan perilaku organisasi,I Hasan,,,,,http://repository.uin-malang.ac.id/981/,"S Slamet, M Munir, I Hasan - 2016 - repository.uin-malang.ac.id",0
Reasoning patterns and modes of prospective biology teachers on embryology learning with TPACK framework,N Nurdiani,NY Rustaman,W Setiawan,,,https://ejournal.umm.ac.id/index.php/jpbi/article/view/7375,"N Nurdiani, NY Rustaman, W Setiawan… - JPBI (Jurnal …, 2019 - ejournal.umm.ac.id",6
Prodi Studi Ilmu Komputer Departemen Pendidikan Ilmu Komputer Fakultas Pendidikan Matematika dan Ilmu Pengetahuan Alam Universitas Pendidikan …,Y Wihardi,,,,,https://ejournal.upi.edu/index.php/JATIKOM/article/download/33178/14258,"A Wikarsa, RA Sukamto, Y Wihardi - Jurnal Aplikasi dan Teori Ilmu … - ejournal.upi.edu",0
Sistem Pencatatan Kehadiran Otomatis di Ruang Kelas Berbasis Pengenalan Wajah Menggunakan Metode Convolutional Neural Network (CNN),W Setiawan,Y Wihardi,,,,http://jatikom.cs.upi.edu/index.php/jatikom/article/view/12,"F Endrianti, W Setiawan, Y Wihardi - JATIKOM: Jurnal Aplikasi …, 2018 - jatikom.cs.upi.edu",6
PENINGKATAN BERPIKIR KRITIS MAHASISWA MELALUI METODE PEMBELAJARAN BERBASIS MASALAH DENGAN BANTUAN ANIMASI ANALISIS GRAFIS,S Kurniawati,,,,,https://ejournal.upi.edu/index.php/JPEI/article/view/28345,"D Disman, S Kurniawati, RA Sukamto - Jurnal Pendidikan Ekonomi … - ejournal.upi.edu",0
Sistem Pencatatan Kehadiran Pertemuan Berbasis Mobile dengan Metode Pengembangan Spiral,R Megasari,,,,,http://jatikom.cs.upi.edu/index.php/jatikom/article/view/21,"A Jatikom, IH Shodiq, R Megasari… - … : Jurnal Aplikasi dan …, 2018 - jatikom.cs.upi.edu",1
Analisis Statistik dan Implementasi Image Masking Berdasarkan Hasil Error Level Analysis Pada Gambar Digital,Y Wihardi,,,,,https://ejournal.upi.edu/index.php/JATIKOM/article/view/33209,"MF Rahman, RRJ Putra, Y Wihardi - Jurnal Aplikasi dan Teori Ilmu … - ejournal.upi.edu",0
Analisis Morfologi untuk Menangani Out-of-Vocabulary Words pada Part-of-Speech Tagger Bahasa Indonesia Menggunakan Hidden Markov Model,Y Wibisono,RA Sukamto,,,,http://inacl.id/journal/index.php/jlk/article/view/13,"F Ramadhanti, Y Wibisono, RA Sukamto - Jurnal Linguistik Komputasional, 2019 - inacl.id",8
The IM and LMS moodle as the TPACK components in improving embryology concepts mastery of prospective biology teachers,N Nurdiani,NY Rustaman,W Setiawan,,,https://aip.scitation.org/doi/abs/10.1063/1.5115712,"N Nurdiani, NY Rustaman, W Setiawan… - AIP Conference …, 2019 - aip.scitation.org",1
"Penerapan Model ARIAS (Assurance, Relevance, Interest, Assesment And Satisfaction) Dalam Pembelajaran TIK (Teknologi Informasi Dan Komunikasi)",P Siahaan,W Setiawan,,,,"http://file.upi.edu/Direktori/JURNAL/PENDIDIKAN_TIK/Jurnal_Pend_TIK_Vol_3_No_1/PENERAPAN_MODEL_ARIAS_(ASSURANCE,_RELEVANCE,_INTEREST,_ASSESMENT_AND_SATISFACTION_)_DALAM_PEMBELAJARAN_TIK_(TEKNOLOGI_INFORMASI_DAN_KOMUNIKASI).pdf","P Siahaan, W Setiawan - Jurnal Pendidikan Teknologi Informasi dan …, 2010 - file.upi.edu",5
The Implementation of Gradient Descent Based Methods Using Parallel Computing in R for Regression Tasks,LS Riza,R Megasari,,,,https://ieeexplore.ieee.org/abstract/document/8673361/,"LS Riza, MA Ashari, R Megasari - … International Symposium on …, 2018 - ieeexplore.ieee.org",1
Analogy mapping for different learning style of learners in programming,RA Sukamto,R Megasari,,,,https://ieeexplore.ieee.org/abstract/document/8257189/,"RA Sukamto, R Megasari - 2017 3rd International Conference …, 2017 - ieeexplore.ieee.org",1
The Strategies for Quorum Satisfaction in Host-to-Host Meeting Scheduling Negotiation,R Megasari,EM Husni,DH Widyantoro,,,https://pdfs.semanticscholar.org/b378/0e9b2b499f0d50bde6b362bf588e60178dc0.pdf,"R Megasari, EM Husni, DH Widyantoro - Telkomnika, 2016 - pdfs.semanticscholar.org",1
Mathematical Interactive Multimedia to Improve Mathematical Reasoning Ability of Senior High School Students,N Priatna,R Hamid,A Widodo,,,https://www.atlantis-press.com/article/25869926.pdf,"N Priatna, R Hamid, A Widodo… - Advance in Soc. Sci …, 2016 - atlantis-press.com",2
Online Learning Behavior During COVID-19 Pandemic toward Students' Digital Literacy Skills,W Setiawan,,,,,http://proceedings2.upi.edu/index.php/icee/article/view/1506,"I Lestari, W Setiawan… - … Conference on Elementary …, 2021 - proceedings2.upi.edu",0
Penerapan Association Rules Menggunakan Algoritma Apriori Pada Sistem Rekomendasi Pemilihan Resep Obat Berdasarkan Data Rekam Medis,R Megasari,,,,,http://jatikom.cs.upi.edu/index.php/jatikom/article/view/18,"A Jatikom, AA Priatna, R Megasari… - … : Jurnal Aplikasi dan …, 2018 - jatikom.cs.upi.edu",2
Kinect Based Motion Capture for 3D Character Animation,Y Wihardi,EF Rahman,,,,https://scholar.archive.org/work/nlnkuw6m75gy3fh647dk3ozezq/access/wayback/https://eudl.eu/pdf/10.4108/eai.12-10-2019.2296516,"Y Wihardi, EF Rahman, FF HN - 2020 - scholar.archive.org",0
Students' Learning Motivation in Distance Learning During the COVID-19 Pandemic Period at Primary School,W Setiawan,,,,,http://proceedings2.upi.edu/index.php/icee/article/view/1486,"V Veronika, W Setiawan… - … on Elementary Education, 2021 - proceedings2.upi.edu",1
Learners mood detection using Convolutional Neural Network (CNN),RA Sukamto,,,,,https://ieeexplore.ieee.org/abstract/document/8257079/,"RA Sukamto, S Handoko - 2017 3rd International …, 2017 - ieeexplore.ieee.org",0
